{
  "schemaVersion": "image-production-result-v1",
  "resultId": "result-affinity-workflow-v1-elemental-wind-v1",
  "targetId": "affinity-workflow-v1-elemental-wind",
  "assignmentId": "assignment-affinity-workflow-v1-elemental-wind",
  "skillVersion": "summonlab-image-production-v1",
  "status": "candidate",
  "attempts": [
    {
      "attemptId": "attempt-affinity-workflow-v1-elemental-wind-1",
      "attemptNumber": 1,
      "precedingAttemptId": null,
      "conclusion": "accepted-by-producer",
      "exactPrompt": "Use case: stylized-concept.\n\nCreate one premium realistic painterly raster character concept for the manifest-bound target \"affinity-workflow-v1-elemental-wind\".\n\nSubject and threat:\n- Species: elemental.\n- Threat presentation tier: elite; reference Grade 4; canonical Grade not assigned.\n- Battlefield duty: bound-frontline-vanguard.\n- Construction mode: substance-bodied.\n- Fixed chassis: bound-vanguard-elemental.\n\nIdentity invariants:\n- the same Bound Vanguard Elemental chassis in every affinity\n- concentrated hexagonal core at the sternum\n- pale arcane binding lattice that remains locally readable\n- broad wedge forearms and a low stable torso\n\nAnatomy invariants:\n- two arms and two legs\n- no head or neck\n- five major body masses: torso, two wedge arms, and two planted legs\n- affinity substance changes while chassis proportions remain fixed\n\nAffinity: wind.\nAffinity expression: directional fur or cloth, vapor channels, debris flow, and pressure distortion with visible force\nCounterplay cue: The still center of the pressure pattern remains visible between directional attacks.\nAltered dimensions: silhouette; motion; attack-telegraph; environmental-wake.\nPermitted transformations: silhouette; motion; attack telegraph; environmental wake.\nProhibited traits: extra limbs; humanoid face; floating amorphous blob; changed chassis proportions; a pale recolor, transparency alone, or effects with no directional force.\n\nPresentation:\n- Style: Pack 2 premium realistic painterly medieval dark fantasy with coherent materials, controlled linework, grounded anatomy, and restrained local magical emission.\n- Medium: premium realistic painterly raster character concept.\n- Background: neutral cracked-stone floor against a charcoal-to-midnight backdrop.\n- Lighting: controlled neutral key with restrained local affinity emission and readable materials.\n- Composition: Exactly one subject; entire creature and every extremity visible, centered with finished detail across the canvas.\n- Canvas: 1536 x 1024 image/png with at least 8 percent safe margin around the entire silhouette and all extremities.\n- Framing lock: fit every hard extent—including weapon tip, standard, horns, tail, and effect wake—inside the central 84 percent of both canvas dimensions; leave a clearly empty border on all four sides.\n\nReference routing, in supplied order:\n1. assets/enemies/review/pack-2/benchmarks/stone-breaker-anchor-v1.png — Individual bipedal elemental framing, grounded weight, wedge forearms, and readable core only; preserve the new Bound Vanguard proportions rather than copying the Stone Breaker identity.\n2. assets/enemies/review/pack-2/elementals-v1.png — Elemental material behavior, coherent cores, restrained local emission, floor, and lighting only; do not transfer any one family member’s anatomy or duty.\n3. assets/enemies/review/pack-2/monster-grade-escalation-v1.png — Pack 2 realistic dark-fantasy finish and neutral presentation only; do not transfer Grade 7 or 10 scale, anatomy, weapons, glow, or the Tower Archmage.\n\nConstraints:\n- No labels, text, UI, frame, logo, or watermark.\n- No extra creature, cropped extremity, blank band, unfinished region, or abrupt canvas cutoff.\n- No resemblance to a published character or reference person.\n",
      "promptHash": "08331e8c4c906aab3f4509749ee72cbe82da3ed3310ee670843f1e9a7fd2d3ae",
      "referenceInputs": [
        {
          "path": "assets/enemies/review/pack-2/benchmarks/stone-breaker-anchor-v1.png",
          "contentHash": "60f46984679fe5f1bb16d2277b1d1aa7c6ca943f810d22e5dfe0ad82717f92c0"
        },
        {
          "path": "assets/enemies/review/pack-2/elementals-v1.png",
          "contentHash": "54e0d1eaa6fe6af23fe8ef2e33b1d4f6893f964561502cf47fc43e7013d63786"
        },
        {
          "path": "assets/enemies/review/pack-2/monster-grade-escalation-v1.png",
          "contentHash": "622a63ea55ab833f0451d29f0967f26f2335c912296ad45537e2a0889c8ecd2e"
        }
      ],
      "requestStartedAt": "2026-08-29T10:49:55.613012152-07:00",
      "generationCompletedAt": "2026-08-29T10:50:16.310055364-07:00",
      "inspectionCompletedAt": "2026-08-29T10:50:26.299350268-07:00",
      "generationDurationMs": 20697,
      "inspectionDurationMs": 9989,
      "totalWallTimeMs": 30686,
      "sourceOutputId": "/home/joao/.codex/generated_images/01a04ea3-9e44-73a3-bdf4-6006608cca3a/exec-e533cb9c-7451-4fc0-8bf7-65c96586b137.png",
      "persistence": {
        "operation": "exclusive-copy",
        "elapsedMs": 17,
        "source": {
          "path": "/home/joao/.codex/generated_images/01a04ea3-9e44-73a3-bdf4-6006608cca3a/exec-e533cb9c-7451-4fc0-8bf7-65c96586b137.png",
          "width": 1536,
          "height": 1024,
          "mediaType": "image/png",
          "bytes": 2699654,
          "contentHash": "249ea5f61e16a64a9437eaaf01488b13ce6c10897799c511dc0e91d116a7d816"
        },
        "retained": {
          "path": "assets/enemies/experiments/affinity-workflow-v1/candidates/elemental/wind-v1.png",
          "width": 1536,
          "height": 1024,
          "mediaType": "image/png",
          "bytes": 2699654,
          "contentHash": "249ea5f61e16a64a9437eaaf01488b13ce6c10897799c511dc0e91d116a7d816"
        }
      },
      "output": {
        "path": "assets/enemies/experiments/affinity-workflow-v1/candidates/elemental/wind-v1.png",
        "width": 1536,
        "height": 1024,
        "mediaType": "image/png",
        "bytes": 2699654,
        "contentHash": "249ea5f61e16a64a9437eaaf01488b13ce6c10897799c511dc0e91d116a7d816"
      },
      "findings": [
        {
          "criterionId": "single-finished-subject",
          "category": "canvas-completion",
          "evaluator": "producer",
          "outcome": "pass",
          "observation": "The entire 1536 by 1024 canvas is intentionally rendered as a continuous charcoal backdrop and cracked-stone floor, with no blank band, unpainted region, or abrupt cutoff."
        },
        {
          "criterionId": "complete-safe-frame",
          "category": "framing",
          "evaluator": "producer",
          "outcome": "pass",
          "observation": "First-attempt framing passes: both wedge forearms, both planted feet, the upper vortex, and the directional pressure-and-debris wake remain inside the central 84-percent framing lock with a visibly empty border on all four sides."
        },
        {
          "criterionId": "single-finished-subject",
          "category": "subject-count",
          "evaluator": "producer",
          "outcome": "pass",
          "observation": "Exactly one featured Bound Vanguard Elemental appears; the small rocks and vapor traces read as one subject's environmental wake rather than additional creatures."
        },
        {
          "criterionId": "blind-species-identity",
          "category": "species-cue-strength",
          "evaluator": "producer",
          "outcome": "not-applicable",
          "observation": "Blind species recognition remains pending human review; known-target inspection finds a compact exposed sternum core, low center of gravity, broad wedge forearms, planted legs, and readable frontline-vanguard construction."
        },
        {
          "criterionId": "blind-affinity-integration",
          "category": "affinity-cue-strength",
          "evaluator": "producer",
          "outcome": "not-applicable",
          "observation": "Blind Wind-affinity recognition remains pending human review; known-target inspection finds a coherent directional vortex, channeled vapor, pressure arcs, and debris flow beyond hue alone."
        },
        {
          "criterionId": "blind-affinity-integration",
          "category": "affinity-integration",
          "evaluator": "producer",
          "outcome": "pass",
          "observation": "Wind changes silhouette, motion, impact telegraph, and environmental wake while the calm hollow center of the upper pressure pattern provides the declared counterplay cue."
        },
        {
          "criterionId": "complete-safe-frame",
          "category": "anatomy",
          "evaluator": "producer",
          "outcome": "pass",
          "observation": "The headless and neckless chassis resolves into exactly five major body masses: one low torso, two coherent wedge-arm masses, and two planted legs with believable joints, contact, and weight."
        },
        {
          "criterionId": "single-finished-subject",
          "category": "battlefield-duty",
          "evaluator": "producer",
          "outcome": "pass",
          "observation": "The low braced advance, forward wedge guards, concentrated core, and focused circular pressure wake communicate a bound frontline vanguard preparing an impact."
        },
        {
          "criterionId": "blind-species-identity",
          "category": "manifest-fidelity",
          "evaluator": "producer",
          "outcome": "pass",
          "observation": "The fixed Bound Vanguard proportions, concentrated hexagonal sternum core, locally readable pale binding lattice, two-arm and two-leg plan, broad wedge forearms, and absence of head, neck, face, or extra limbs are preserved."
        },
        {
          "criterionId": "single-finished-subject",
          "category": "style-cohesion",
          "evaluator": "producer",
          "outcome": "pass",